{
    "_id": "91a5c64c-f34e-491a-bb40-55c4a0563d6b",
    "totalCost": 1000,
    "items": [
      {
        "productId": "43dcecc9-724c-4062-ac8f-402621f18485",
        "productUrl": "http://localhost:8080/products/43dcecc9-724c-4062-ac8f-402621f18485",
        "quantity": 2,
        "unitPrice": 500
      }
    ],
    "_class": "com.omega.bioway.cart.crosscutting.entities.Cart"
}